{"schema_version":1,"mode":"demo","generated_utc":"2026-10-19T12:00:00Z","as_of_utc":"2026-10-19T12:00:00Z","source":"demo-generator","trades":[{"id":"T-0001","symbol":"GBPUSD","side":"SELL","strategy_id":"S07","opened_utc":"2026-09-22T03:29:00Z","closed_utc":"2026-09-22T03:52:00Z","entry":1.28682,"exit":1.28742,"stop_loss":1.28742,"take_profit":1.28622,"result_r":-1,"exit_reason":"STOP","risk_pct":0.25,"simulated":true,"agent_decision_id":"DEC-0001","tags":["momentum","gbpusd","paper"],"note":"Simulated on M1 candles (THREE_BAR_MOMENTUM · NORMAL · 120s · TREND_DOWN). Stop checked before target; spread floor applied."},{"id":"T-0002","symbol":"XAUUSD","side":"BUY","strategy_id":"S02","opened_utc":"2026-09-22T03:50:00Z","closed_utc":"2026-09-22T04:01:00Z","entry":3978.21,"exit":3986.25,"stop_loss":3972.85,"take_profit":3986.25,"result_r":1.5,"exit_reason":"TARGET","risk_pct":0.25,"simulated":true,"agent_decision_id":"DEC-0002","tags":["momentum","xauusd","paper"],"note":"Simulated on M1 candles (THREE_BAR_MOMENTUM · REVERSE · 60s · TREND_UP). Stop checked before target; spread floor applied."},{"id":"T-0003","symbol":"XAUUSD","side":"SELL","strategy_id":"S10","opened_utc":"2026-09-22T06:42:00Z","closed_utc":"2026-09-22T07:12:00Z","entry":4011.4,"exit":4007.38,"stop_loss":4016.43,"take_profit":4006.37,"result_r":0.799,"exit_reason":"TIME","risk_pct":0.25,"simulated":true,"agent_decision_id":"DEC-0003","tags":["pullback","xauusd","paper"],"note":"Simulated on M1 candles (EMA_PULLBACK · NORMAL · 60s · TREND_DOWN). Stop checked before target; spread floor applied."},{"id":"T-0004","symbol":"GBPUSD","side":"BUY","strategy_id":"S04","opened_utc":"2026-09-22T10:46:00Z","closed_utc":"2026-09-22T10:58:00Z","entry":1.28762,"exit":1.28799,"stop_loss":1.28701,"take_profit":1.28799,"result_r":0.607,"exit_reason":"TARGET","risk_pct":0.25,"simulated":true,"agent_decision_id":"DEC-0004","tags":["wick","gbpusd","paper"],"note":"Simulated on M1 candles (THREE_GREEN_RED_WICK · NORMAL · 120s · VOLATILE). Stop checked before target; spread floor applied."},{"id":"T-0005","symbol":"EURUSD","side":"BUY","strategy_id":"S05","opened_utc":"2026-09-22T17:51:00Z","closed_utc":"2026-09-22T18:21:00Z","entry":1.09583,"exit":1.09595,"stop_loss":1.0953,"take_profit":1.09636,"result_r":0.226,"exit_reason":"TIME","risk_pct":0.25,"simulated":true,"agent_decision_id":"DEC-0005","tags":["sweep","eurusd","paper"],"note":"Simulated on M1 candles (SWEEP_RECLAIM · NORMAL · 60s · RANGE). Stop checked before target; spread floor applied."},{"id":"T-0006","symbol":"XAUUSD","side":"BUY","strategy_id":"S07","opened_utc":"2026-09-23T00:00:00Z","closed_utc":"2026-09-23T00:47:00Z","entry":4044.89,"exit":4049.81,"stop_loss":4039.97,"take_profit":4049.81,"result_r":1,"exit_reason":"TARGET","risk_pct":0.25,"simulated":true,"agent_decision_id":"DEC-0006","tags":["momentum","xauusd","paper"],"note":"Simulated on M1 candles (THREE_BAR_MOMENTUM · NORMAL · 120s · TREND_DOWN). Stop checked before target; spread floor applied."},{"id":"T-0007","symbol":"EURUSD","side":"BUY","strategy_id":"S07","opened_utc":"2026-09-23T07:17:00Z","closed_utc":"2026-09-23T08:07:00Z","entry":1.09371,"exit":1.09446,"stop_loss":1.09321,"take_profit":1.09446,"result_r":1.5,"exit_reason":"TARGET","risk_pct":0.25,"simulated":true,"agent_decision_id":"DEC-0007","tags":["momentum","eurusd","paper"],"note":"Simulated on M1 candles (THREE_BAR_MOMENTUM · NORMAL · 120s · TREND_DOWN). Stop checked before target; spread floor applied."},{"id":"T-0008","symbol":"EURUSD","side":"SELL","strategy_id":"S08","opened_utc":"2026-09-23T12:13:00Z","closed_utc":"2026-09-23T12:28:00Z","entry":1.09517,"exit":1.09511,"stop_loss":1.09567,"take_profit":1.09442,"result_r":0.12,"exit_reason":"TIME","risk_pct":0.25,"simulated":true,"agent_decision_id":"DEC-0008","tags":["wick","eurusd","paper"],"note":"Simulated on M1 candles (THREE_RED_GREEN_WICK · REVERSE · 30s · RANGE). Stop checked before target; spread floor applied."},{"id":"T-0009","symbol":"GBPUSD","side":"BUY","strategy_id":"S09","opened_utc":"2026-09-23T14:18:00Z","closed_utc":"2026-09-23T14:23:00Z","entry":1.29707,"exit":1.29633,"stop_loss":1.29633,"take_profit":1.29781,"result_r":-1,"exit_reason":"STOP","risk_pct":0.25,"simulated":true,"agent_decision_id":"DEC-0009","tags":["sweep","gbpusd","paper"],"note":"Simulated on M1 candles (SWEEP_RECLAIM · NORMAL · 120s · VOLATILE). Stop checked before target; spread floor applied."},{"id":"T-0010","symbol":"XAUUSD","side":"BUY","strategy_id":"S04","opened_utc":"2026-09-23T14:25:00Z","closed_utc":"2026-09-23T14:51:00Z","entry":4111.2,"exit":4101.31,"stop_loss":4101.31,"take_profit":4126.03,"result_r":-1,"exit_reason":"STOP","risk_pct":0.25,"simulated":true,"agent_decision_id":"DEC-0010","tags":["wick","xauusd","paper"],"note":"Simulated on M1 candles (THREE_GREEN_RED_WICK · NORMAL · 120s · VOLATILE). Stop checked before target; spread floor applied."},{"id":"T-0011","symbol":"XAUUSD","side":"BUY","strategy_id":"S01","opened_utc":"2026-09-23T15:25:00Z","closed_utc":"2026-09-23T15:36:00Z","entry":4109.27,"exit":4099.57,"stop_loss":4099.57,"take_profit":4123.82,"result_r":-1,"exit_reason":"STOP","risk_pct":0.25,"simulated":true,"agent_decision_id":"DEC-0011","tags":["momentum","xauusd","paper"],"note":"Simulated on M1 candles (THREE_BAR_MOMENTUM · NORMAL · 30s · RANGE). Stop checked before target; spread floor applied."},{"id":"T-0012","symbol":"GBPUSD","side":"BUY","strategy_id":"S06","opened_utc":"2026-09-23T18:14:00Z","closed_utc":"2026-09-23T18:40:00Z","entry":1.29249,"exit":1.29295,"stop_loss":1.29172,"take_profit":1.29295,"result_r":0.597,"exit_reason":"TARGET","risk_pct":0.25,"simulated":true,"agent_decision_id":"DEC-0012","tags":["pullback","gbpusd","paper"],"note":"Simulated on M1 candles (EMA_PULLBACK · NORMAL · 120s · TREND_UP). Stop checked before target; spread floor applied."},{"id":"T-0013","symbol":"XAUUSD","side":"SELL","strategy_id":"S01","opened_utc":"2026-09-24T05:09:00Z","closed_utc":"2026-09-24T05:19:00Z","entry":4104.32,"exit":4109.34,"stop_loss":4109.34,"take_profit":4096.78,"result_r":-1,"exit_reason":"STOP","risk_pct":0.25,"simulated":true,"agent_decision_id":"DEC-0013","tags":["momentum","xauusd","paper"],"note":"Simulated on M1 candles (THREE_BAR_MOMENTUM · NORMAL · 30s · RANGE). Stop checked before target; spread floor applied."},{"id":"T-0014","symbol":"XAUUSD","side":"SELL","strategy_id":"S01","opened_utc":"2026-09-24T07:40:00Z","closed_utc":"2026-09-24T07:45:00Z","entry":4101.55,"exit":4095.85,"stop_loss":4107.25,"take_profit":4095.85,"result_r":1,"exit_reason":"TARGET","risk_pct":0.25,"simulated":true,"agent_decision_id":"DEC-0014","tags":["momentum","xauusd","paper"],"note":"Simulated on M1 candles (THREE_BAR_MOMENTUM · NORMAL · 30s · RANGE). Stop checked before target; spread floor applied."},{"id":"T-0015","symbol":"GBPUSD","side":"BUY","strategy_id":"S10","opened_utc":"2026-09-24T08:39:00Z","closed_utc":"2026-09-24T08:46:00Z","entry":1.29412,"exit":1.29352,"stop_loss":1.29352,"take_profit":1.29502,"result_r":-1,"exit_reason":"STOP","risk_pct":0.25,"simulated":true,"agent_decision_id":"DEC-0015","tags":["pullback","gbpusd","paper"],"note":"Simulated on M1 candles (EMA_PULLBACK · NORMAL · 60s · TREND_DOWN). Stop checked before target; spread floor applied."},{"id":"T-0016","symbol":"GBPUSD","side":"SELL","strategy_id":"S06","opened_utc":"2026-09-24T09:16:00Z","closed_utc":"2026-09-24T09:19:00Z","entry":1.29374,"exit":1.29434,"stop_loss":1.29434,"take_profit":1.29338,"result_r":-1,"exit_reason":"STOP","risk_pct":0.25,"simulated":true,"agent_decision_id":"DEC-0016","tags":["pullback","gbpusd","paper"],"note":"Simulated on M1 candles (EMA_PULLBACK · NORMAL · 120s · TREND_UP). Stop checked before target; spread floor applied."},{"id":"T-0017","symbol":"GBPUSD","side":"SELL","strategy_id":"S04","opened_utc":"2026-09-24T18:34:00Z","closed_utc":"2026-09-24T19:06:00Z","entry":1.30108,"exit":1.30039,"stop_loss":1.30177,"take_profit":1.30039,"result_r":1,"exit_reason":"TARGET","risk_pct":0.25,"simulated":true,"agent_decision_id":"DEC-0017","tags":["wick","gbpusd","paper"],"note":"Simulated on M1 candles (THREE_GREEN_RED_WICK · NORMAL · 120s · VOLATILE). Stop checked before target; spread floor applied."},{"id":"T-0018","symbol":"XAUUSD","side":"SELL","strategy_id":"S01","opened_utc":"2026-09-25T01:12:00Z","closed_utc":"2026-09-25T01:27:00Z","entry":4118.27,"exit":4117.8,"stop_loss":4123.2,"take_profit":4115.31,"result_r":0.095,"exit_reason":"TIME","risk_pct":0.25,"simulated":true,"agent_decision_id":"DEC-0018","tags":["momentum","xauusd","paper"],"note":"Simulated on M1 candles (THREE_BAR_MOMENTUM · NORMAL · 30s · RANGE). Stop checked before target; spread floor applied."},{"id":"T-0019","symbol":"XAUUSD","side":"BUY","strategy_id":"S10","opened_utc":"2026-09-25T02:35:00Z","closed_utc":"2026-09-25T02:40:00Z","entry":4123.09,"exit":4118.58,"stop_loss":4118.58,"take_profit":4125.8,"result_r":-1,"exit_reason":"STOP","risk_pct":0.25,"simulated":true,"agent_decision_id":"DEC-0019","tags":["pullback","xauusd","paper"],"note":"Simulated on M1 candles (EMA_PULLBACK · NORMAL · 60s · TREND_DOWN). Stop checked before target; spread floor applied."},{"id":"T-0020","symbol":"XAUUSD","side":"BUY","strategy_id":"S04","opened_utc":"2026-09-25T09:54:00Z","closed_utc":"2026-09-25T10:01:00Z","entry":4120.43,"exit":4127.31,"stop_loss":4113.55,"take_profit":4127.31,"result_r":1,"exit_reason":"TARGET","risk_pct":0.25,"simulated":true,"agent_decision_id":"DEC-0020","tags":["wick","xauusd","paper"],"note":"Simulated on M1 candles (THREE_GREEN_RED_WICK · NORMAL · 120s · VOLATILE). Stop checked before target; spread floor applied."},{"id":"T-0021","symbol":"XAUUSD","side":"BUY","strategy_id":"S05","opened_utc":"2026-09-25T10:13:00Z","closed_utc":"2026-09-25T10:35:00Z","entry":4124.84,"exit":4131.7,"stop_loss":4117.98,"take_profit":4131.7,"result_r":1,"exit_reason":"TARGET","risk_pct":0.25,"simulated":true,"agent_decision